Speaker,Line,Episode,Arc
Saionji,I'm the one keeping the promise with you.,9,1
Anthy,Promise? ,9,1
Saionji,"Correct. Tonight, we'll finally be able to go to the castle said to hold eternity.",9,1
Anthy,"No, you mustn't. ",9,1
Anthy,It's not allowed for anyone not engaged to me to take me to the duel arena without the arrangement ofa duel.,9,1
Saionji,The Ends of the World told me that the castle would fall tonight.,9,1
Saionji,I won't let anybody else have you. ,9,1
Saionji,The one to obtain eternity with you... ,9,1
Saionji,...WILL BE ME! ,9,1
Utena,"Sheesh, what the... ",9,1
Utena,Sa... Saionji? ,9,1
Utena,"Saionji, wake up! ",9,1
Saionji,Tenjou... ,9,1
Utena,Where's Himemiya? ,9,1
Saionji,Anthy... ,9,1
Utena,What are you up to? ,9,1
Utena,"I thought you couldn't take her back without beating me in a duel, right?",9,1
Saionji,What the hell are you doing here? ,9,1
Utena,I was told to come here because Himemiya would be spirited away.,9,1
Saionji,Spirited away? ,9,1
Saionji,Spirited away... ,9,1
Saionji,Spirited away... ,9,1
Saionji,Anthy... ,9,1
Saionji,Where's Anthy? ,9,1
Utena,That's what I'm asking you. ,9,1
Saionji,Hey! ,9,1
Saionji,Did you open it? ,9,1
Utena,"No, not me. ",9,1
Saionji,Impossible... ,9,1
Utena,"Hey, wait! ",9,1
Utena,What the... ,9,1
Saionji,This... ,9,1
Narration,Please don't open it. ,9,1
Narration,"Eternity couldn't possibly exist, could it?",9,1
Utena,Himemiya... ,9,1
Saionji,Anthy! ,9,1
Saionji,What? ,9,1
Utena,What the... ,9,1
Utena,Himemiya! ,9,1
Saionji,Tenjou! ,9,1
Utena,What's going on here? ,9,1
Utena,"Anyway, I've gotta save Himemiya! ",9,1
Saionji,The castle... the castle's falling down.,9,1
Saionji,"Here I am, Ends of the World! ",9,1
Saionji,Now fulfill your promise and deliver eternity unto me!,9,1
Utena,HIMEMIYA!!!!! ,9,1
Saionji,What's this? What's going on here? ,9,1
Saionji,What the hell was that? ,9,1
Utena,Himemiya... Himemiya... ,9,1
Utena,"Himemiya! Hey, snap out of it, Himemiya! ",9,1
Saionji,No... I was to be the one to rescue her from the coffin this time.,9,1
Saionji,No! I am the one who will save her this time. The castle said to contain eternity...,9,1
Saionji,the power to revolutionize the world... ,9,1
Saionji,...will all be mine. ,9,1
Saionji,The one who will accompany Anthy to that castle will be me!,9,1
Utena,Himemiya... ,9,1
Utena,Himemiya! Himemiya! ,9,1
Anthy,Utena-sama... ,9,1
Utena,I'm so glad... ,9,1
Utena,"But, what on earth happened? ",9,1
Anthy,"Actually, I'm not quite sure... ",9,1
Anthy,Utena-sama! ,9,1
Utena,Touga! Why? ,9,1
Touga,Wasn't your prince... ,9,1
Touga,...someone like me? ,9,1
Saionji,Why do you always... ,9,1
Touga,"I'm a gentleman, that's why. ",9,1
Touga,It's me. ,9,1
Touga,"Yes, the letter sent to Saionji tonight was from me.",9,1
Touga,"Right, in your name. ",9,1
Touga,"No, it's just a flesh wound. ",9,1
Touga,"Well, just a few dramatics. ",9,1
Touga,"Yes, Saionji will be punished by expulsion. ",9,1
Touga,Nonsense. ,9,1
Touga,Anyone who truly believes he has friends is a fool.,9,1
ED,Missing truth and forever ,9,1
ED,Kissing love and true your heart ,9,1
ED,Embrace me with your true arms ,9,1
ED,The key to open up tomorrow is reality ,9,1
ED,I want to keep on destroying lies. ,9,1
ED,"Even if we keep on talking, ",9,1
ED,you still won't ever see. ,9,1
ED,Excuses really suit adults ,9,1
ED,who hang on to old stories. ,9,1
ED,Because unchosen angels ,9,1
ED,have no need for wings. ,9,1
ED,"Missing truth and forever, ",9,1
ED,"Kissing love and true your heart, ",9,1
ED,I will like tomorrow's new me. ,9,1
ED,"At least I believe so; I want to believe it,",9,1
ED,so I want to keep lies hating me.,9,1
OP,"Heroically, with bravery",10,1
OP,"I'll go on with my life, ",10,1
OP,"just a long, long time. ",10,1
OP,But if the two of us should get split up ,10,1
OP,"by whatever means, ",10,1
OP,"let go of me, ",10,1
OP,Take my revolution. ,10,1
Title,Utena ~ La Fillette Revolutionnaire ,10,1
OP,"In the sunny garden, we held each other's hands,",10,1
OP,"drew close together and soothed each other with the words,",10,1
OP,"""Neither of us will ever fall in love again."" ",10,1
OP,Everytime ,10,1
OP,Into this photograph of us ,10,1
OP,"smiling cheek to cheek, ",10,1
OP,"I took a bit of loneliness, ",10,1
OP,and crammed it inside. ,10,1
OP,Revolution! ,10,1
OP,"Even in my dreams, even through my tears, ",10,1
OP,"even though I'm being hurt, ",10,1
OP,"reality is approaching now, frantically. ",10,1
OP,What I want now is to find out ,10,1
OP,"just where I belong, ",10,1
OP,"and my self-worth, up through today. ",10,1
OP,"Heroically, I'll throw away ",10,1
OP,"my clothes 'til I'm nude, ",10,1
OP,"like the roses dancing all around me, whirling free.",10,1
OP,But if the two of us should get split up ,10,1
OP,"by whatever means, ",10,1
OP,"I swear to you, I will change the world.",10,1
sign,"Senior High 11th Grade, Class A Saionji Kyouichi The above named person has been punished by expulsion forflagrantly violating the Academy's rules of conduct. Provost, OhtoriAcademy",10,1
Boy,"A Hey, did you hear about Saionji? ",10,1
sign,"Senior High 11th Grade, Class A Saionji Kyouichi",10,1
Boy,"B Yeah, I heard. What the heck did he do? ",10,1
sign,has been punished by expulsion ,10,1
Boy,"B Did you say ""expelled?"" ",10,1
Juri,That fool... ,10,1
Juri,Starting a Duel over his desire for the Rose Bride without permission from the Ends of the World...,10,1
Juri,Is there any limit to his shame? ,10,1
Miki,"I thought he might do that eventually, ",10,1
Miki,"but now that he has, does it really seem true to character?",10,1
Juri,So he turned out to be the laughingstock of the Student Council.,10,1
Touga,I'll do everything in my power to have your expulsion overturned as quickly as possible.,10,1
Saionji,Sorry to further burden you... ,10,1
Touga,Your's and Himemiya's exchange diary? ,10,1
Touga,I see. ,10,1
Touga,I'll take responsibility for delivering it to her.,10,1
Saionji,Sorry for all the trouble I've caused thus far.,10,1
Touga,"Don't worry about it; after all, we are best friends.",10,1
Title,Nanami's Precious One ,10,1
Touga,"If the egg's shell does not break, the chick will die without being born.",10,1
Touga,We are the chick; the egg is the world. ,10,1
Touga,"If the world's shell does not break, we will die without being born.",10,1
Touga,Break the world's shell! ,10,1
Juri,For the sake of revolutionizing the world! ,10,1
Miki,For the sake of revolutionizing the world! ,10,1
Saionji,For the sake of revolutionizing the world! ,10,1
Touga,For the sake of revolutionizing the world! ,10,1
Touga,We've received a new letter from the Ends of the World.,10,1
Touga,Another Duel will be soon upon us. ,10,1
Juri,"Taking turns, Touga should be next, but... ",10,1
Miki,Touga-sempai's wound hasn't healed yet. ,10,1
Miki,I'll fight in his place. ,10,1
Juri,You can't beat Utena. ,10,1
Juri,"I'll go. I will crush Tenjou Utena for sure, this time.",10,1
Miki,"I'm going. Please back down, Juri-san. ",10,1
Juri,What? ,10,1
Touga,"Not so hasty, you two. ",10,1
Touga,There is yet another Duelist. ,10,1
Miki,That's crazy! ,10,1
Juri,"Are you telling me that the Ends of the World has deemed someone else,",10,1
Juri,"besides us and Utena, eligible to participate in the Duels?",10,1
Nanami,It's your fault my brother got hurt! Your fault!,10,1
Nanami,Why don't you say something? ,10,1
Nanami,Why should my brother have to get hurt over someone like you?,10,1
Utena,I'm sorry. ,10,1
Utena,"If I'd been on my toes, none of this would have ever happened.",10,1
Utena,I'm sorry. ,10,1
Nanami,Don't give me that! ,10,1
Nanami,Your apologies won't heal my brother's wound!,10,1
Touga,Nanami! ,10,1
Touga,Nanami... ,10,1
Nanami,Onii-sama... ,10,1
Touga,This wound is nothing to get excited about.,10,1
Touga,"Besides, rescuing ladies in distress is a knight's job.",10,1
Utena,Mr. President... ,10,1
Touga,"As long as you are safe, I'll be satisfied with that.",10,1
Nanami,I won't forgive you. ,10,1
Nanami,"Never, ever, will I forgive you! ",10,1
Touga,It's nothing to worry about. ,10,1
Touga,"Nanami is just upset, that's all. ",10,1
Touga,She at least knows it's not your fault. ,10,1
Utena,"Should have known, a girl can't become a prince...",10,1
Anthy,What's wrong? You seem depressed. ,10,1
Utena,I should be depressed. ,10,1
Utena,"Mr. President got hurt because he was protecting me, after all.",10,1
Anthy,I wonder if everything is all right... ,10,1
Utena,That's what I'm worried about. ,10,1
Utena,"Guess I should make a proper duty visit, eh?",10,1
Utena,I haven't even thanked him for saving me.,10,1
Anthy,"Oh, I know! Any chance that you're hungry? ",10,1
Utena,"Thanks, but I don't feel like having shaved ice right now, though...",10,1
Utena,What's that for? ,10,1
Anthy,"Hmm, what should I call this little guy? ",10,1
Utena,"So, you were talking to... ",10,1
Anthy,"Um, Utena-sama... ",10,1
Anthy,"Since a lot of them are blooming now, how about some roses?",10,1
Anthy,"You are going to visit him, aren't you? ",10,1
Utena,Himemiya... ,10,1
Anthy,"After all, no one feels bad about receiving flowers.",10,1
Utena,Thanks. ,10,1
Boy,"A Happy Birthday, Touga-sama. ",10,1
Boy,B Happy Birthday. ,10,1
Nanami,Onii-sama.. ,10,1
Nanami,Happy Birthday. ,10,1
Mama,"Nanami, why do you look like that? ",10,1
Nanami,This is for Onii-sama. ,10,1
Mama,"Feh, what a dirty looking thing. ",10,1
Mama,Get it out of here! ,10,1
Nanami,"But, mama... ",10,1
Papa,Give it to me. ,10,1
Nanami,No! ,10,1
Touga,Wait a minute. ,10,1
Touga,"Thank you, Nanami. ",10,1
Touga,This is the best present I ever got. ,10,1
Nanami,Onii-sama was always so nice to me... always shielding me.,10,1
Nanami,"Onii-sama's smiling face was all mine, but...",10,1
Nanami,"Don't, Onii-sama. You'll aggravate your wound.",10,1
Touga,"I'm all right. If I don't get some exercise, I'll get out of shape.",10,1
Nanami,"If you try too hard right now, you'll just get worse.",10,1
Nanami,"Please, stop! ",10,1
Touga,"Hey, you don't have to go that far... ",10,1
Nanami,"Please, stop. ",10,1
Nanami,"If something ever happened to you, I'd... ",10,1
Touga,Nothing's going to happen to me. ,10,1
Touga,Right? ,10,1
Nanami,Aren't you... ,10,1
Nanami,Aren't you going to kiss me? ,10,1
Touga,"Why should I? After all, we're not children anymore.",10,1
Touga,You seem surprised. ,10,1
Touga,"Well, I'm going to get some sleep. ",10,1
Touga,"Good night, Nanami. ",10,1
Utena,"Um, Mr. President's not here? ",10,1
Girl,It seems he sent word that he'd be absent today.,10,1
Utena,I see... ,10,1
Girl,"But, I guess you can see him at the party. ",10,1
Utena,Party? ,10,1
Girl,"Tonight, at the President's house. ",10,1
Girl,"I guess he has to show up there, even if he is cutting classes.",10,1
Girl,"Happy Birthday, Touga-sama. ",10,1
Girl,This is from both of us. ,10,1
Utena,"Oh, she meant a birthday party. ",10,1
Anthy,Didn't you know? ,10,1
Utena,You did? ,10,1
Anthy,Yes. ,10,1
Juri,"You can tell me already, can't you? ",10,1
Juri,Who's the next Duelist going to be? ,10,1
Touga,"Hey, hey... ",10,1
Touga,"This is my birthday party, you know. ",10,1
Touga,Why ruin such an enjoyable time with talk of the Ends of the World?,10,1
Juri,The Duel is set for tomorrow night. ,10,1
Touga,Relax. The stage is already set. ,10,1
Touga,"Hello, I'm so glad you came. ",10,1
Touga,What's that? ,10,1
Utena,"Don't get me wrong, okay? ",10,1
Utena,"This is just a ""get well"" visit. ",10,1
Utena,Since I haven't thanked you for saving me yet...,10,1
Utena,What's so funny? ,10,1
Touga,"No, I'm sorry. I was just thinking that it's so like you, making an excuse like that.",10,1
Utena,"You're making fun of me, aren't you? ",10,1
Touga,"No, I'm glad to have you here. ",10,1
Utena,What's that supposed to mean? ,10,1
Nanami,What a shameful girl... ,10,1
Nanami,Are you trying to seduce my brother with these?,10,1
Touga,"Nanami, stop it already. ",10,1
Nanami,"You stop it, Onii-sama. ",10,1
Nanami,She's the one who hurt you. ,10,1
Utena,"Hey, that's not true! ",10,1
Anthy,Please don't be so hard on Utena-sama. ,10,1
Anthy,That was all Saionji-sempai's... ,10,1
Nanami,Silence! ,10,1
Nanami,"You're the cause of it, anyway! ",10,1
Utena,Stop that! What's with you? ,10,1
Nanami,I'll never let you have him. ,10,1
Nanami,I'll never let the likes of you have my brother!,10,1
Boy,Is that what's going on? ,10,1
Boy,"Touga and Utena, huh? ",10,1
Boy,"Well, there's a surprise. ",10,1
Utena,"No, there's nothing really between us... ",10,1
Touga,"I suppose it's my fault, for spoiling her.",10,1
Touga,"Despite all I say, ",10,1
Touga,Nanami is still her brother's girl. ,10,1
Utena,"Because you're the ""World's Greatest Brother,"" of course any other boy would be worthless.",10,1
Touga,Did Miki say that? ,10,1
Utena,Maybe. ,10,1
Touga,He talks too much. ,10,1
Touga,It must have been at one of my birthday parties.,10,1
Touga,"Nanami didn't have a present for me, so she went and found a kitten.",10,1
Utena,A kitten? ,10,1
Touga,"Even though the kitten disappeared soon after, that was the present that made me happiest.",10,1
Anthy,Um... ,10,1
Anthy,I just missed my chance to give you mine just now.,10,1
Touga,"Hey, stop that, you... ",10,1
Anthy,You don't like cats? ,10,1
Touga,"Oh, no, I do, and thank you, it's a wonderful present.",10,1
Touga,Get out of here! ,10,1
Nanami,"Onii-sama, come help me pick some apples. ",10,1
Touga,"OK, later. ",10,1
Nanami,"But I can't reach them. Come on, Onii-sama... ",10,1
Touga,"Leave me alone, I'm playing with this kitten here.",10,1
Nanami,Bad kitty! ,10,1
Touga,"Quit that! He's just playing around, you know.",10,1
Nanami,But... ,10,1
Touga,Get out of here! ,10,1
Nanami,"It's your own fault, for coming between me and my brother.",10,1
Nanami,Onii-sama belongs only to me! ,10,1
Miki,"Stop that, Nanami-kun. ",10,1
Miki,Do you even know what you're doing? ,10,1
Nanami,"Don't even think of trying to escape me, Tenjou-san.",10,1
Juri,"If you make a fuss, you'll be expelled just like Saionji.",10,1
Nanami,I don't care. ,10,1
Touga,The Academy has its rules. ,10,1
Touga,"Nanami, give me your left hand. ",10,1
Nanami,Onii-sama... ,10,1
Touga,"Have you forgotten, Nanami? ",10,1
Touga,The Rose Signet is the only piece of authentication that allows you fight Duels here at the Academy.,10,1
Touga,"Now show me your power, as a chosen one of the ""Ends of the World.""",10,1
Miki,"You mean, Nanami-kun is also a Duelist? ",10,1
Touga,"Tomorrow night, at the Arena, you will fight this next Duel.",10,1
Shadow,"Look, look, I've found a kitten. ",10,1
Shadow,I wonder what I should name it. ,10,1
Shadow,"How about ""Jewel?"" ",10,1
Shadow,That's too ordinary. Aren't there any more unusual names?,10,1
Shadow,"""Unusual Jewel"" ",10,1
Shadow,"Umm, no, not quite. Isn't there a name which is more tasteful?",10,1
Shadow,"""Tasteful Unusual Jewel"" ",10,1
Shadow,"No, that's not it... ",10,1
Shadow,"Isn't there some name that's cute-sounding, dignified, and easy to remember?",10,1
Shadow,"""Cute-sounding Dignified Easy to Remember Tasteful Unusual Jewel""",10,1
Shadow,"Oh, all right, already! ",10,1
Shadow,"If ""Jewel"" is really that good, than ""Jewel"" it is.",10,1
Shadow,"Come here, Juliano. ",10,1
Shadow,"Hey, I said enough with the cute names! ",10,1
ZUM,The Absolute Destiny: Apocalypse ,10,1
ZUM,The Absolute Destiny: Apocalypse ,10,1
ZUM,Birth records ,10,1
ZUM,Baptismal records ,10,1
ZUM,Death records ,10,1
ZUM,The Absolute Destiny: Apocalypse ,10,1
ZUM,The Absolute Destiny: Apocalypse ,10,1
ZUM,"My own birth, ",10,1
ZUM,"Absolute birth, ",10,1
ZUM,Apocalypse ,10,1
ZUM,A wet-nurse and a midwife in a dark desert ,10,1
ZUM,A gold-gilded Shangri-La ,10,1
ZUM,Day and night reversing ,10,1
ZUM,A time-gilded Lost Paradise ,10,1
ZUM,Darkness over Sodom ,10,1
ZUM,Darkness ever glowing ,10,1
ZUM,Darkness over yonder ,10,1
ZUM,Darkness never ending ,10,1
ZUM,The Absolute Destiny: Apocalypse ,10,1
ZUM,The Absolute Destiny: Apocalyptic Darkness; Apocalypse,10,1
ZUM,mokushi kushimo shimoku kumoshi moshiku shikumo,10,1
ZUM,mokushi kushimo shimoku kumoshi moshiku shikumo,10,1
Utena,Do we really have to do this? ,10,1
Nanami,"You two are an eyesore, always hovering around my brother.",10,1
Nanami,"This fight is for real, Tenjou Utena! ",10,1
Anthy,"O roses of the noble castle, ",10,1
Anthy,"O Power of Dios that slumbers within me,",10,1
Anthy,harken unto thy master and reveal to us...,10,1
Utena,...the power to revolutionize the world! ,10,1
Utena,She's quick... ,10,1
Nanami,Don't underestimate me. ,10,1
Nanami,"For the past 13 years, I've watched my brother like a hawk.",10,1
LastEvo,Beginning of the earth ,10,1
LastEvo,Stage props ,10,1
LastEvo,the Laplace nebula ,10,1
LastEvo,Spectatorism ,10,1
LastEvo,Unchanging illusion ,10,1
LastEvo,Mystery solving clock ,10,1
Nanami,I know everything there is to know about him.,10,1
LastEvo,Baby carriage of the ,10,1
LastEvo,edge of immortality. ,10,1
Nanami,"Of course, that also includes his sword techniques.",10,1
LastEvo,My eternal self and ,10,1
Nanami,You might say my martial arts are my brother's martial arts.,10,1
Nanami,"And this ring, I received from my prince. ",10,1
LastEvo,the eternal stranger ,10,1
Nanami,My prince is going to lead me to victory! ,10,1
Utena,That's not going to happen! ,10,1
LastEvo,two relations; two births ,10,1
LastEvo,scales of mystery; human constellation,10,1
Utena,Fight's over. ,10,1
Nanami,This fight is just beginning! ,10,1
Anthy,"You can't, Nanami-san. The rule says that the one whose rose gets scattered, loses.",10,1
LastEvo,"Time is hypothetical, an illusional prop",10,1
Nanami,That's no concern of mine! ,10,1
LastEvo,of the beginnings of birth.,10,1
LastEvo,"Destiny, choice, goodbye-ism",10,1
LastEvo,You and I are the Milky Way,10,1
LastEvo,"Having no past, only the present, having no future,",10,1
LastEvo,A single person in the Theatre Cosmic. That's me!,10,1
Utena,"Give it up, Nanami. Fighting like this is pointless.",10,1
LastEvo,Wait! My last evolution-revolution-everlution,10,1
Touga,That's far enough! ,10,1
Nanami,"It's your own fault, for coming between me and my brother.",10,1
Utena,Nanami... ,10,1
Nanami,"I will win, Onii-sama. ",10,1
Nanami,I'm not beaten yet. ,10,1
Touga,Silly girl... ,10,1
Touga,Nanami... ,10,1
Touga,There's no need for you to fight anymore. ,10,1
Touga,I'll protect you. ,10,1
Nanami,Onii-sama! ,10,1
Nanami,Forgive me. ,10,1
Nanami,"Onii-sama, forgive me. ",10,1
Touga,"All right, all right already. ",10,1
Utena,"I guess you can be brotherly, when you feel like it.",10,1
Touga,I can't just watch silently when a girl is in crisis.,10,1
Touga,I guess it's just the prince in me. ,10,1
Touga,I've collected the data I needed. ,10,1
Touga,The Power of Dios will be mine! ,10,1
ED,Missing truth and forever ,10,1
ED,Kissing love and true your heart ,10,1
ED,Embrace me with your true arms ,10,1
ED,The key to open up tomorrow is reality ,10,1
ED,I want to keep on destroying lies. ,10,1
ED,"Even if we keep on talking, ",10,1
ED,you still won't ever see. ,10,1
ED,Excuses really suit adults ,10,1
ED,who hang on to old stories. ,10,1
ED,Because unchosen angels ,10,1
ED,have no need for wings. ,10,1
ED,"Missing truth and forever, ",10,1
ED,"Kissing love and true your heart, ",10,1
ED,I will like tomorrow's new me. ,10,1
ED,"At least I believe so; I want to believe it,",10,1
ED,so I want to keep lies hating me.,10,1
OP,"Heroically, with bravery",11,1
OP,"I'll go on with my life, ",11,1
OP,"just a long, long time. ",11,1
OP,But if the two of us should get split up ,11,1
OP,"by whatever means, ",11,1
OP,"let go of me, ",11,1
OP,Take my revolution. ,11,1
Title,Utena ~ La Fillette Revolutionnaire ,11,1
OP,"In the sunny garden, we held each other's hands,",11,1
OP,"drew close together and soothed each other with the words,",11,1
OP,"""Neither of us will ever fall in love again."" ",11,1
OP,Everytime ,11,1
OP,Into this photograph of us ,11,1
OP,"smiling cheek to cheek, ",11,1
OP,"I took a bit of loneliness, ",11,1
OP,and crammed it inside. ,11,1
OP,Revolution! ,11,1
OP,"Even in my dreams, even through my tears, ",11,1
OP,"even though I'm being hurt, ",11,1
OP,"reality is approaching now, frantically. ",11,1
OP,What I want now is to find out ,11,1
OP,"just where I belong, ",11,1
OP,"and my self-worth, up through today. ",11,1
OP,"Heroically, I'll throw away ",11,1
OP,"my clothes 'til I'm nude, ",11,1
OP,"like the roses dancing all around me, whirling free.",11,1
OP,But if the two of us should get split up ,11,1
OP,"by whatever means, ",11,1
OP,"I swear to you, I will change the world. ",11,1
Utena,It feels so good to have lunch outdoors for a change.,11,1
Wakaba,You bet! You bet! ,11,1
Wakaba,"I'm so smart to suggest it, aren't I? ",11,1
Wakaba,Here here here... ,11,1
Wakaba,"See, I made some for you too. ",11,1
Utena,But I... ,11,1
Wakaba,"No way. Such a tasteless lunch would be boring, right?",11,1
Wakaba,"Instead of that, have some of this lunch full of my love for Utena-sama!",11,1
Wakaba,Look... Look! LOOK! ,11,1
Utena,Yeah... ,11,1
Wakaba,I'm so glad! ,11,1
Utena,Cut it out already! ,11,1
Title,Graceful and Ruthless; The One Who Picks the Flower,11,1
Wakaba,"Now, don't be too surprised! Tah-dah! ",11,1
Wakaba,"Basically these are prepackaged food, but the forms look super-pretty, don't they?",11,1
Utena,"Well, love or not, there's no doubt they look delicious.",11,1
Utena,"Thanks, Wakaba. ",11,1
Wakaba,All right! ,11,1
Wakaba,Now that makes my cooking effort pay off!,11,1
Wakaba,"That's just like you, Wakaba-chan! Well done!",11,1
Anthy,Utena-sama... ,11,1
Anthy,"Would you take a look at my lunch, too? ",11,1
Utena,If it isn't shaved ice again... ,11,1
Anthy,Here. ,11,1
Utena,"Wow, that's quite a lot. ",11,1
Wakaba,Impressive... ,11,1
Anthy,"Please, have some. ",11,1
Utena,The first layer is... ,11,1
Wakaba,Takoyaki... aren't they? ,11,1
Anthy,Yes. ,11,1
Utena,And the second layer... ,11,1
Wakaba,"Yakisoba... okay, okay... ",11,1
Anthy,"It looks delicious, doesn't it? ",11,1
Utena,The third layer is... ,11,1
Anthy,"Oh, my! ",11,1
Utena,"Well, what do you know! Pretty normal, although it's like food from a temple festival or something.",11,1
Wakaba,"""Pretty normal?"" What kind of lunch were you expecting?",11,1
Utena,"Uh, let's talk about it after we eat. ",11,1
Miki,What do you see? ,11,1
Touga,"Oh, it's you. ",11,1
Touga,I see a lonely princess. ,11,1
Miki,"Tenjou-sempai, and Himemiya-san, too. Looks like they're enjoying themselves.",11,1
Miki,"But by a lonely princess, you mean...? ",11,1
Touga,You can't see her. ,11,1
Touga,No one can see her but me. ,11,1
Miki,You mean it's an illusion? ,11,1
Touga,"Oh, she really exists. ",11,1
Touga,She's visible and tangible. ,11,1
Wakaba,Bravo! Bravo! ,11,1
Wakaba,"What're you looking at, Utena? ",11,1
Utena,"Oh, nothing. ",11,1
Wakaba,"A-ha, it's the Prince of the Student Council.",11,1
Utena,"""Prince?"" ",11,1
Utena,"That time, he definitely said... ",11,1
Touga,"""Wasn't your prince someone like me?"" ",11,1
Utena,"If that's true, then is Mr. President my prince from back then?",11,1
Anthy,Bravo! Bravo! ,11,1
Wakaba,"Are you alright, eating like that? ",11,1
Touga,"If the egg's shell does not break, the chick will die without being born.",11,1
Touga,We are the chick; the egg is the world. ,11,1
Touga,"If the world's shell does not break, we will die without being born.",11,1
Touga,Break the world's shell! ,11,1
Touga,For the sake of revolutionizing the world!,11,1
Juri,For the sake of revolutionizing the world!,11,1
Touga,"As you may already know, ",11,1
Touga,Nanami lost the Duel to Tenjou Utena. ,11,1
Touga,"I'm ashamed to say, the difference in their abilities was made clear.",11,1
Juri,As it was from the start. ,11,1
Juri,Nanami-kun fought only to lose... ,11,1
Juri,"...just as Student Council President Kiryuu Touga had planned, right?",11,1
Touga,It's regrettable that you see it that way.,11,1
Touga,Since I always try to treat Nanami with affection...,11,1
Miki,Like a pet cat? ,11,1
Miki,6.12 seconds... ,11,1
Touga,It was her own fault that Nanami lost the Duel.,11,1
Touga,"Whether it was someone's plot or not, ",11,1
Touga,joining into it was her own responsibility. ,11,1
Juri,How cold. ,11,1
Touga,There can be times when the depths of one's feelings can lead them astray.,11,1
Touga,"The greater those feelings, the further they are led.",11,1
Touga,"""Wasn't your prince someone like me?"" ",11,1
Touga,Well and truly beautiful... ,11,1
Touga,And this breed is said to be very difficult. ,11,1
Anthy,Thank you very much. ,11,1
Touga,"By the way, you all were having lunch outside today, weren't you?",11,1
Anthy,"Yes. You saw, didn't you? ",11,1
Anthy,"With Utena-sama, Wakaba-san, and Chuchu. ",11,1
Anthy,It was a lot of fun. ,11,1
Touga,That's excellent. ,11,1
Anthy,Wakaba-san's lunch was so delicious. ,11,1
Anthy,I want to make a dish like that. ,11,1
Touga,"The Rose Bride, cooking? ",11,1
Touga,You shouldn't do such things as cooking. ,11,1
Touga,You should only take care of the roses here.,11,1
Touga,This birdcage is your territory. ,11,1
Touga,And you are the beautiful little bird which lives here.,11,1
Touga,"I want to possess this birdcage, and everything in it.",11,1
Touga,"I would never take you out from here, ever...",11,1
Touga,Forever... ,11,1
Utena,Stay away from Himemiya! ,11,1
Touga,"Hi, I'm glad you've come. ",11,1
Utena,"You don't see Himemiya as anything but the Rose Bride either, do you?",11,1
Touga,Is that wrong? ,11,1
Utena,It is wrong! ,11,1
Utena,"Cut it out with that ""Rose Bride"" or ""possession"" nonsense.",11,1
Utena,That girl is an ordinary girl named Himemiya Anthy!,11,1
Touga,Is she? ,11,1
Touga,Is it true that you're an ordinary girl? ,11,1
Utena,"You don't like it, do you? ",11,1
Utena,Being the Rose Bride or whatever... ,11,1
Anthy,I... ,11,1
Utena,"Go ahead, speak your mind! ",11,1
Anthy,My mind... ,11,1
Utena,Yeah! ,11,1
Utena,"You hate being treated as the Rose Bride, right?",11,1
Utena,Tell him clearly! ,11,1
Anthy,All right. ,11,1
