Speaker,Line,Episode,Arc
Saionji,Welcome back. ,20,2
Saionji,You're kind of late. ,20,2
Wakaba,I'm home. ,20,2
Sensei,"...therefore, it seems likely that something similar to this will appear on the next test.",20,2
Sensei,"Okay, next question... let's see, who will do this one?",20,2
Wakaba,I will! ,20,2
Students,Me! Me! Me! Me! Me! ,20,2
Sensei,"Well then, Tenjou-san. ",20,2
Utena,"Yes, ma'am! ",20,2
Letter,"Dear Saionji-san, I left some lunch money for you.",20,2
Wakaba,Something the matter? ,20,2
Utena,Huh? ,20,2
Wakaba,Well? ,20,2
Utena,"Um, did something good happen to you recently?",20,2
Wakaba,"Not really, why? ",20,2
Utena,"Oh, nothing, it just seems that you're full of life lately.",20,2
Utena,And also... ,20,2
Wakaba,And what? ,20,2
Utena,"Uh, you've gotten really pretty. ",20,2
Wakaba,"What? Oh, stop that, Utena! ",20,2
Utena,"No, it's true, it's true, I tell you. ",20,2
Wakaba,"Sheesh, again and again, nothing but lies.",20,2
Utena,"It's true, I tell you... ",20,2
Wakaba,"See ya, Utena! ",20,2
Akio,Oh? Wakaba-san... ,20,2
Utena,Right. She's completely different now. ,20,2
Akio,Like the goddess who leaves her name to the stars in the heavens... is that how it is?,20,2
Utena,But how did she become so pretty all of a sudden?,20,2
Akio,"You don't understand, do you? ",20,2
Akio,"You, living out your predestined fate... ",20,2
Utena,Huh? ,20,2
Akio,There are special people in the world. ,20,2
Akio,And they are always noticed. ,20,2
Akio,"For example, like yourself... ",20,2
Utena,Me? ,20,2
Akio,"Attend me. You're not particularly self-conscious, correct?",20,2
Akio,That is the special quality that you carry from birth.,20,2
Utena,Oh? ,20,2
Akio,Most people are but a single person amongst multitudes.,20,2
Akio,"However, given the slightest chance, they will shine with a light that they have never had before.",20,2
Wakaba,"Hey, what're you making there? ",20,2
Saionji,It's a secret. ,20,2
Utena,I've just wanted Wakaba to be happy for a long time.,20,2
Wakaba,How much sugar would you like? ,20,2
Saionji,Here... ,20,2
Akio,"It could even be said, that for many people, their special time lasts but briefly.",20,2
Saionji,"It's not finished yet, ",20,2
Saionji,"...but for what it's worth, this is my gift to you as my thanks for your sincerity.",20,2
Wakaba,"Oh, really now... ",20,2
Wakaba,This is... enough for me. ,20,2
Wakaba,Student Council President Kiryuu still hasn't been to school.,20,2
Wakaba,"In his place, Nanami-san is Acting Studing Council President.",20,2
Wakaba,It looks like Miki-kun is doing his best to assist Nanami-san.,20,2
Wakaba,Arisugawa-sempai is the same as usual. ,20,2
Wakaba,That's the impression that I get for the Student Council as a whole.,20,2
Saionji,"Hmm, I see. By the way... ",20,2
Wakaba,Yes! ,20,2
Saionji,Um... ,20,2
Wakaba,Ask me anything. ,20,2
Saionji,Okay. Um... how's Anthy? ,20,2
Wakaba,Himemiya-san? ,20,2
Saionji,"Uh, I was just asking... ",20,2
Wakaba,Saionji-san wants to return to the Academy. ,20,2
Wakaba,"When he's finished living with me, he'll probably forget all about me.",20,2
Cashier,"That'll be 2,060 yen. ",20,2
Saionji,Evening already? ,20,2
Mikage,"What an enviable position you're in, Saionji Kyouichi-kun.",20,2
Saionji,You... Mikage! ,20,2
Mikage,It's been a while... ,20,2
Saionji,"When, I mean how'd you get in here? ",20,2
Mikage,The Black Rose Society is privy to even the smallest secrets in the Academy.,20,2
Mikage,"But all that aside, Saionji-kun... ",20,2
Mikage,"Imagine, you who once served as Student Council Vice President,",20,2
Mikage,...now reduced to freeloading with a female student.,20,2
Saionji,I don't intend to idle here indefinitely. ,20,2
Saionji,"Eventually, I will return to the Academy, nay, even the Student Council.",20,2
Mikage,Oh? How? ,20,2
Saionji,Well... ,20,2
Mikage,"What do you plan to do about your current state, having wasted your time?",20,2
Saionji,Well... ,20,2
Mikage,Well what? ,20,2
Mikage,"You could do something, had you a bit of our power.",20,2
Saionji,What? ,20,2
Mikage,We are distressed by the future prospects of the Academy.,20,2
Mikage,Your talent is very precious. ,20,2
Saionji,"I see, so that's how it is. ",20,2
Saionji,What should I do instead? ,20,2
Mikage,"Well, you see... ",20,2
Mikage,There's one item that I want from you. ,20,2
Mikage,"A trifle, really... ",20,2
Wakaba,"No matter how much I try to be his friend, no matter how much I think about him,",20,2
Wakaba,...his heart has belonged to that girl from the start.,20,2
Wakaba,"That girl, with her face that says she alone is special,",20,2
Wakaba,will steal everything and anything away from me.,20,2
Wakaba,I simply can't bring myself to forgive her.,20,2
Wakaba,"Whether in love, or my studies, in the end I'm just another face in the crowd.",20,2
Wakaba,My world is completely different from that of the special people.,20,2
Wakaba,"But... but... If he's there, if he's with me, then I am special.",20,2
Wakaba,"Just a little bit longer, and I would have been reborn.",20,2
Wakaba,"That, that, that girl... ",20,2
Wakaba,That girl... ,20,2
Mikage,I understand. ,20,2
Mikage,I suppose you have no choice but to revolutionize the world.,20,2
Mikage,The way before you has been prepared. ,20,2
Mikage,So... ,20,2
Saionji,I didn't think he'd ask me to bring him that thing to grant my wish.,20,2
Saionji,"Of course, I knew I couldn't stay in this sort of place forever.",20,2
Saionji,Okay! Ready to go! ,20,2
Saionji,"Saionji Kyouichi, heading for a new era of glory... moving out!",20,2
Wakaba,Going somewhere? ,20,2
Saionji,"Ah, what... ",20,2
Saionji,I was wondering who it was. I'm sorry for inconveniencing you all this time.,20,2
Saionji,I'm returning to the world I used to know.,20,2
Wakaba,Where is that hairclip? ,20,2
Saionji,"Oh, something happened, so I can't give it to you anymore.",20,2
Saionji,"But, don't worry, I plan to buy you something expensive instead,",20,2
Saionji,"...and I want to mail it to you if I can, so is this address okay?",20,2
Wakaba,Never mind. ,20,2
Wakaba,I've got something better now. ,20,2
Saionji,That's... ,20,2
Utena,"Hey, a sunshower. ",20,2
Card,To the one engaged: I shall wait for you at the Duel Arena this evening.,20,2
Shadow,Extra! Extra! Extra! ,20,2
Shadow,"At last, at last, it's finally raining! ",20,2
Shadow,"Whenever it rains on a sunny day, we have to hurry and get married.",20,2
Shadow,That's the custom of us fox-girls. ,20,2
Shadow,You guys are so lucky. ,20,2
Shadow,"You see, we can't get married until it snows on a sunny day.",20,2
Shadow,That's the code of us bunny-girls. ,20,2
Utena,What's wrong with not getting married? ,20,2
Wakaba,I swear by this black rose... ,20,2
Anthy,Utena-sama... ,20,2
Wakaba,"...to triumph in this duel, ",20,2
Anthy,Draw the sword from me. ,20,2
Wakaba,...and bring death to the Rose Bride! ,20,2
Anthy,The sword! Hurry! ,20,2
Utena,"Anthy, I can't. ",20,2
Utena,I can't fight her. ,20,2
Utena,"To point a sword at my friend, Wakaba... ",20,2
Anthy,The sword! Quickly! ,20,2
Wakaba,That's right! I'm going to kill her! ,20,2
Wakaba,I'll kill the girl who stole Saionji-sama's heart!,20,2
Utena,Saionji? ,20,2
Utena,Why are you doing this? ,20,2
Utena,"You've been so radiant, Wakaba... so why?",20,2
Wakaba,You just don't understand! ,20,2
Wakaba,You couldn't possibly understand! ,20,2
Anthy,"Quickly, quickly, the sword! ",20,2
Wakaba,"Oh, Saionji-sama! ",20,2
Utena,Saionji? ,20,2
Wakaba,"Student Council Vice President and captain of the Kendo Club, Saionji Kyouichi-sama.",20,2
Utena,"Stop, Wakaba! Stop it now!Wakaba! ",20,2
Utena,"This Saionji, is he going out with that Himemiya girl?",20,2
Wakaba,As if! There's no way tough old Saionji could ever have feelings for a girl like her.,20,2
Wakaba,The only reason they're together is because they're in the Student Council.,20,2
Anthy,Utena-sama! ,20,2
Wakaba,"You, that girl, the Student Council members... all of you look down on me.",20,2
Wakaba,"Without a care in the world, flaunting the power you all were born with!",20,2
Wakaba,"So, you all can so calmly... ",20,2
Anthy,Utena-sama! ,20,2
Wakaba,...walk all over everyone else! ,20,2
Utena,Wakaba... ,20,2
Utena,"Certainly, there are a lot of things I don't know,",20,2
Utena,But I do know this for sure: ,20,2
Utena,You are my best friend. ,20,2
Utena,"Just wait, and I'll save you now. ",20,2
DS20,"Oh, the pity! Although the aged man",20,2
DS20,put all his strength ,20,2
DS20,"into his skillful sword, ",20,2
DS20,How pathetic his skill is in his age...,20,2
DS20,"He misses his target, sword swishing through the air,",20,2
DS20,"staggers and falls, oh, that old man.",20,2
DS20,"A shrieking sword swish, Troy's castle tower,",20,2
DS20,"and the burning summit was rent asunder, with a thunderclap.",20,2
DS20,"Paris was deafened temporarily, ahhh...",20,2
DS20,Witness! ,20,2
DS20,"The white-haired old man, ",20,2
DS20,"raising it as if to cut, holds his sword up in the sky,",20,2
DS20,and Paris is petrified. ,20,2
DS20,"Paris soon regains his hostility,",20,2
DS20,"and brings his blood-stained, dripping blade",20,2
DS20,down upon the aged king! ,20,2
Mikage,"I could just dismiss any useless boys, ",20,2
Mikage,"...but if Saionji's such a clown, I guess leaving him there would be more fun.",20,2
Juri,I suppose that Saionji's just beaming with pride.,20,2
Nanami,He's mighty full of himself for someone who had been expelled.,20,2
Juri,"I wonder if he plans to return to the Student Council, acting like that.",20,2
Nanami,"Honestly, the nerve of him. ",20,2
Miki,"Still, I wonder how he got reinstated after being expelled.",20,2
Nanami,I heard it was at the recommendation of the Black Rose Society.,20,2
Miki,Oh? ,20,2
Wakaba,I'm home. ,20,2
ED,Missing truth and forever ,20,2
ED,Kissing love and true your heart ,20,2
ED,Embrace me with your true arms ,20,2
ED,The key to open up tomorrow is reality ,20,2
ED,I want to keep on destroying lies. ,20,2
ED,"Even if we keep on talking, ",20,2
ED,you still won't ever see. ,20,2
ED,Excuses really suit adults ,20,2
ED,who hang on to old stories. ,20,2
ED,Because unchosen angels ,20,2
ED,have no need for wings. ,20,2
ED,"Missing truth and forever, ",20,2
ED,"Kissing love and true your heart, ",20,2
ED,I will like tomorrow's new me. ,20,2
ED,"At least I believe so; I want to believe it,",20,2
ED,so I want to keep lies hating me. ,20,2
OP,"Heroically, with bravery",21,2
OP,"I'll go on with my life, ",21,2
OP,"just a long, long time. ",21,2
OP,But if the two of us should get split up ,21,2
OP,"by whatever means, ",21,2
OP,"let go of me, ",21,2
OP,Take my revolution. ,21,2
Title,Utena ~ La Fillette Revolutionnaire ,21,2
OP,"In the sunny garden, we held each other's hands,",21,2
OP,"drew close together and soothed each other with the words,",21,2
OP,"""Neither of us will ever fall in love again."" ",21,2
OP,Everytime ,21,2
OP,Into this photograph of us ,21,2
OP,"smiling cheek to cheek, ",21,2
OP,"I took a bit of loneliness, ",21,2
OP,and crammed it inside. ,21,2
OP,Revolution! ,21,2
OP,"Even in my dreams, even through my tears, ",21,2
OP,"even though I'm being hurt, ",21,2
OP,"reality is approaching now, frantically. ",21,2
OP,What I want now is to find out ,21,2
OP,"just where I belong, ",21,2
OP,"and my self-worth, up through today. ",21,2
OP,"Heroically, I'll throw away ",21,2
OP,"my clothes 'til I'm nude, ",21,2
OP,"like the roses dancing all around me, whirling free.",21,2
OP,But if the two of us should get split up ,21,2
OP,"by whatever means, ",21,2
OP,"I swear to you, I will change the world.",21,2
Aiko,"You look pretty as always, Nanami-sama. ",21,2
Yuuko,"There's no match for you in this academy, Nanami-sama.",21,2
Keiko,"We're really happy being allowed to be with you, Nanami-sama.",21,2
title,Troublesome Insects ,21,2
banners,Ohtori Academy Junior High - Entrance Ceremony -,21,2
Yuuko,Hey... ,21,2
Yuuko,"You're in the same class as us, right? ",21,2
Aiko,"If you like, why don't you join our group? ",21,2
Keiko,Let's be friends. ,21,2
Touga,"It was a wonderful entrance ceremony, Nanami.",21,2
Nanami,Onii-sama! ,21,2
Yuuko,Isn't that Kiryuu Touga-sama? ,21,2
Aiko,"It is, it's Touga-sama, the Student Council President!",21,2
Keiko,Then this girl is... ,21,2
Yuuko,Touga-sama's little sister?! ,21,2
Aiko,It's so dreamy! ,21,2
Keiko,It's so dreamy! ,21,2
Yuuko,It's so dreamy! ,21,2
Aiko,"Ah, what a wonderful encounter! ",21,2
Keiko,"Ah, what a wonderful encounter! ",21,2
Yuuko,"Ah, what a wonderful encounter! ",21,2
Aiko,"It's like, meeting Nanami-sama changed my life.",21,2
Keiko,We were lucky we were the first ones to talk to Nanami-sama.,21,2
Yuuko,We've got to be grateful. Nanami-sama chose us from among so many students.,21,2
Aiko,"Yeah, we were selected to serve Nanami-sama. ",21,2
Keiko,"That's right, Aiko! ",21,2
Aiko,"Keiko, Yuuko! ",21,2
Aiko,"From now on, let's work together and give it our best shot!",21,2
Keiko,Right! ,21,2
Yuuko,We're all the chosen ones. ,21,2
Aiko,Let's do it! ,21,2
Keiko,Let's do it! ,21,2
Yuuko,Let's do it! ,21,2
Nanami,I know! A party! ,21,2
Nanami,Why didn't I come up with it sooner? ,21,2
Nanami,I'll throw a magnificent party to encourage my brother!,21,2
Nanami,And it's got to be really magnificent! ,21,2
Nanami,"As things are, I won't be particular. ",21,2
Nanami,I'll generously invite all the prominent people in the entire academy!,21,2
boy,"Oh, Kiryuu-san, you're on day duty, right? ",21,2
Nanami,That will definitely cheer up my brother! ,21,2
boy,"Wipe the blackboard, would you? ",21,2
Keiko,"That's a great idea, Nanami-sama! ",21,2
Yuuko,Touga-sama has really been looking gloomy lately.,21,2
Aiko,"I'm really touched by your consideration for your brother, Nanami-sama!",21,2
boy,"K- Kiryuu-san, the blackboard... ",21,2
Nanami,Would you all help me with it? ,21,2
Aiko,"Yes, gladly! ",21,2
Keiko,"Yes, gladly! ",21,2
Yuuko,"Yes, gladly! ",21,2
Juri,A party? ,21,2
Keiko,Do please attend. ,21,2
Juri,When the Student Council is in such crisis? Honestly...,21,2
Keiko,Please! ,21,2
Keiko,Please! ,21,2
Keiko,Please! ,21,2
Keiko,Nanami-sama really worries about Touga-sama. ,21,2
Keiko,PLEASE!!! ,21,2
Keiko,Please! ,21,2
Keiko,I'll get to see Touga-sama for the first time in a long while.,21,2
Keiko,But I know he won't be looking at a girl like me.,21,2
Keiko,"Touga-sama, still I... ",21,2
Keiko,Aiko! Yuuko! ,21,2
Keiko,"For Touga-sama and Nanami-sama, let's work together and get everything ready!",21,2
Yuuko,"Yeah, but you seem awfully spirited today, Keiko.",21,2
Keiko,"Oh, do I? ",21,2
Yuuko,"That's a new dress, right? It looks good on you.",21,2
Keiko,Really? ,21,2
Yuuko,"Really! Really! It looks good on her, right, Aiko?",21,2
Aiko,"Yep, it looks so lovely. ",21,2
Keiko,"Thank you, Yuuko, Aiko! ",21,2
Nanami,Well? ,21,2
Nanami,Have the preparations been made? ,21,2
KIU,"Yes, ma'am! ",21,2
Keiko,We barely made it. ,21,2
Nanami,"Oh, Keiko-san. I have a little favor to ask of you.",21,2
Keiko,What is it? ,21,2
Nanami,I completely forgot I had some paperwork to finish up for the Student Council tonight.,21,2
Nanami,"I'm sorry, Keiko-san, but would you get it done for me?",21,2
Keiko,But the party... ,21,2
Nanami,"But everything's ready, isn't it? ",21,2
Keiko,Yea... Yes. ,21,2
Nanami,"Then, there isn't a problem, is there? ",21,2
Nanami,"The paperwork is at the school. So, please go right now.",21,2
Keiko,"Um, Nanami-sama? ",21,2
Nanami,Is anything wrong? ,21,2
Keiko,No. ,21,2
Nanami,"Then, please. ",21,2
Keiko,"Yes, ma'am. ",21,2
Keiko,I... have always... ,21,2
Keiko,I have always been watching Touga-sama. ,21,2
Keiko,Always... ,21,2
Keiko,The only one who can approach the prince is the princess from the wonder world.,21,2
Keiko,Touga-sama... He lives in a different world from mine.,21,2
Keiko,Right. A girl like me... ,21,2
Utena,"Touga looked better than we thought, didn't he?",21,2
Miki,But he still doesn't show himself in the academy.,21,2
Utena,"The way the president is, the Student Council must be in trouble.",21,2
Nanami,"Oh, are you so worried about my brother... ",21,2
Nanami,...that you sneak around and spy on him?,21,2
Nanami,How disgusting. ,21,2
Utena,Don't be ridiculous! Who did anything like that?!,21,2
Keiko,"My, my. Are you playing dumb? ",21,2
Yuuko,You were talking about him just now. What nerve!,21,2
Utena,I went to the party because I was invited! ,21,2
Nanami,"My, I just thought, ""Even a dead tree may add to the beauty of a mountain,"" and you got conceited.",21,2
Nanami,What impudent people there are in this world!,21,2
Utena,Now look... ,21,2
Keiko,Why don't you try to think about your own standing?,21,2
Aiko,I'll say! ,21,2
Yuuko,I'll say! ,21,2
Nanami,I can't stand it to even think about a girl like you hanging around my brother.,21,2
Nanami,"Right, I won't allow even a single insect to swarm on my brother.",21,2
Nanami,"Shall we go, everyone? ",21,2
Miki,"I'm sorry, Tenjou-sempai. ",21,2
Utena,"Don't apologize, Micky. It happens all the time.",21,2
Anthy,"I'm sorry, um... Was I sleeping? Was I?",21,2
Utena,"Chuchu was crying all last night, wasn't he?",21,2
Utena,"You see, the open cluster Pleiades... ",21,2
Utena,"...is known as Subaru in Japan, and is even mentioned in Sei Shounagon's ""Pillow Book.""",21,2
Anthy,"That's pretty detailed, Utena-sama. ",21,2
Utena,"Well, that's just what Akio-san told me. I've been studying from him closely of late.",21,2
Anthy,I see. ,21,2
Akio,"Wonderful, aren't they? The winter constellations... ",21,2
Anthy,Onii-sama... ,21,2
Akio,Friendship is beautiful. ,21,2
Akio,"Castor and Pollux of the Gemini are known to be very friendly with each other, but...",21,2
Akio,"The way you're watching the stars together, you look even more beautiful than the Gemini.",21,2
Utena,"Oh, that can't be... ",21,2
Utena,"Well, I'm outta here. ",21,2
Anthy,"All right, Utena-sama. ",21,2
Akio,"All right, Anthy, you should continue to be friendly with Utena-san.",21,2
Akio,Just like Castor and Pollux of the Gemini. ,21,2
Anthy,"Yes, Onii-sama. ",21,2
Keiko,What should I do? Touga-sama is getting soaked.,21,2
Keiko,Lend him my umbrella... ,21,2
Keiko,But a girl like me and Touga-sama? ,21,2
Keiko,But a chance like this won't come again. ,21,2
Keiko,"Excuse me, Touga-sama? ",21,2
Keiko,"If it's okay, won't you join me? ",21,2
Keiko,The rain is bad for your health. ,21,2
Keiko,"Nanami-sama? It's me, Nanami-sama. ",21,2
Keiko,"Where are you, Nanami-sama? ",21,2
Nanami,"I'm right here, Keiko-san. ",21,2
Keiko,Nanami-sama... ,21,2
Keiko,You said you wanted to see me? ,21,2
Nanami,"Sonoda Keiko-san, you are now dismissed from all clubs,",21,2
Nanami,"the dorm's self-government association, culture circles, and all the other organizations you belong to.",21,2
Keiko,"Why is that, Nanami-sama? ",21,2
Nanami,Why?! ,21,2
Nanami,Don't play dumb! ,21,2
Nanami,How careless I was! The real troublesome insect was right under my feet!,21,2
Nanami,To think that I didn't notice until today!,21,2
Keiko,Nanami-sama... ,21,2
Nanami,"I told you, I won't allow even a single insect to swarm on my brother.",21,2
Nanami,I'll thoroughly exterminate all troublesome insects like you.,21,2
Keiko,"Oh, no... ",21,2
Nanami,"Please prepare yourself, Keiko-san. ",21,2
Yuuko,Nanami-sama is about to leave. ,21,2
Aiko,"We should leave, too. ",21,2
Keiko,Yuuko! Aiko! ,21,2
Keiko,"Please, you two intercede with Nanami-sama for me!",21,2
Keiko,You're the only ones who can help me! ,21,2
Keiko,Please! ,21,2
Yuuko,Did you hear something? ,21,2
Aiko,Not a thing. ,21,2
Keiko,I admired Nanami-sama from the bottom of my heart.,21,2
Keiko,"That's what I believed, and I've been serving her.",21,2
Keiko,"But actually, that wasn't true. ",21,2
Keiko,"I was only with Nanami-sama to get close to Touga-sama, even the littlest bit.",21,2
Keiko,"Without that reason, who'd want to be with her?",21,2
Mikage,Deeper... Go deeper. ,21,2
Keiko,That selfish... ,21,2
Keiko,I'm a single girl! What's wrong with me falling in love with someone?,21,2
Keiko,Why do I have to hold back because of her?,21,2
Keiko,"Just because she's Touga-sama's sister, she monopolizes his love.",21,2
Keiko,Even right before my own eyes! ,21,2
Keiko,And that girl has no idea... ,21,2
Keiko,...how I felt all this time! ,21,2
Keiko,She doesn't even try to understand! ,21,2
Mikage,I understand. ,21,2
Mikage,I suppose you have no choice but to revolutionize the world.,21,2
Mikage,The way before you has been prepared. ,21,2
Keiko,Where am I? ,21,2
Keiko,Touga-sama... ,21,2
Keiko,Look at me. ,21,2
Keiko,Touga-sama... ,21,2
Keiko,Touga-sama! ,21,2
Keiko,"From now on, please look only at me! ",21,2
plate,Tenjou Utena ,21,2
card,To the one Engaged: I shall wait for you at the Duel Arena this evening.,21,2
Shadow,Extra! Extra! Extra! ,21,2
Shadow,Any bad insects here? Any bad insects here?,21,2
Shadow,"Oh, it's Namahage! (an ogre-like demon) ",21,2
Shadow,"No, I'm a mantis. Snipsnipsnip! ",21,2
Shadow,"Everyone, hurry up and run! ",21,2
Shadow,Snipsnipsnip! ,21,2
Shadow,Run! Run! ,21,2
Shadow,Snipsnipsnipsnip! ,21,2
Shadow,Run! Runrunrun! ,21,2
Shadow,Snipsnipnipsnipsnipsnisnipsnips! ,21,2
Shadow,Runrunrunrurunrunrun! ,21,2
Shadow,"Damn, just running away won't fix this. Take this insecticide!",21,2
Shadow,"Can't breathe, snip... ",21,2
Shadow,"We're gonna die, too! ",21,2
Shadow,It's a curse... ,21,2
Utena,That's a room deodorant. ,21,2
Utena,You're... ,21,2
Keiko,I swear by this Black Rose... ,21,2
Keiko,...that I shall win this Duel and bring death to the Rose Bride!,21,2
Utena,You're... ,21,2
Keiko,"With this sword, Touga-sama's sword, I will defeat you.",21,2
Utena,Touga's sword? ,21,2
Keiko,"For my and Touga-sama's future, I will fight.",21,2
Keiko,"Now, draw your sword! ",21,2
Utena,...the power to revolutionize the world! ,21,2
Utena,Why are you... ,21,2
Keiko,You should know well what kind of girl Nanami is.,21,2
Keiko,She doesn't even think of a girl like me as a person.,21,2
Keiko,"Knowing that, I've been serving her anyway. ",21,2
Utena,But I don't understand - why Touga's sword?,21,2
Keiko,You don't need to know! ,21,2
Keiko,"Can you beat this sword, Tenjou Utena? ",21,2
Keiko,"This sword, Touga-sama's sword! ",21,2
Keiko,The noblest sword in the world! ,21,2
Keiko,"With this sword, I will attain the great power.",21,2
Keiko,"And then, I will kill that girl! ",21,2
Keiko,I'll kill that Nanami who stands between Touga-sama and me!,21,2
Keiko,That's right. The real troublesome insect is Nanami!,21,2
Keiko,I see. That girl is a troublesome insect. ,21,2
Utena,I don't even know her name. ,21,2
Utena,I thought she was Nanami's friend. ,21,2
Utena,"It's scary how the roots of one's hatred spread underground, unseen.",21,2
DS21,Vanish! Fade away! Melt away! ,21,2
DS21,Get out of my sight! ,21,2
DS21,Any and all people! ,21,2
DS21,Vanish! Fade away! Melt away! ,21,2
DS21,Get out of my sight! ,21,2
DS21,The instant imposters. ,21,2
DS21,Betrayed by wishes... ,21,2
DS21,Avenged by hope. ,21,2
DS21,Periods like this are tedious.,21,2
DS21,I will run away. ,21,2
DS21,"Everyone, disappear! ",21,2
DS21,Even now there's nothing that I want!,21,2
DS21,"Straddling an unmanned sidecar,",21,2
DS21,"Daydream journey of three thousand leagues,",21,2
DS21,"Subway, freeway, runway ",21,2
DS21,I'm going! At a hundred kilometers per hour...,21,2
DS21,"A hero, a swift wind, a fugitive.",21,2
Mikage,Another failure. ,21,2
Mikage,"But it is interesting, that she called her master an insect.",21,2
Keiko,"I'm happy only being with you, Nanami-sama. ",21,2
Keiko,"There's no way a girl like me can love Touga-sama, is there?",21,2
Nanami,"You're right. Considering your own standing, it's obvious.",21,2
Nanami,"Please continue to be with me forever, Keiko-san.",21,2
Keiko,"Yes, certainly. ",21,2
Yuuko,"Keiko, we've been friends all along. ",21,2
Aiko,"Yes, we are, no matter what happens. ",21,2
Utena,I just don't know... ,21,2
Anthy,The one with her hair tied and her bangs curled is Keiko-san.,21,2
Anthy,The one with shoulder-length hair curling to the outside is Aiko-san.,21,2
Anthy,The one with her hair curling to the inside around her cheeks is Yuuko-san.,21,2
Utena,That's not what I'm talking about. How can she still be Nanami's friend?,21,2
Utena,Even though she's actually carrying all sorts of feelings...,21,2
Anthy,That's easy. ,21,2
Anthy,"For someone you love, your feelings for any other people become insignificant.",21,2
Anthy,You can deceive yourself as much as you need.,21,2
ED,Missing truth and forever ,21,2
ED,Kissing love and true your heart ,21,2
ED,Embrace me with your true arms ,21,2
ED,The key to open up tomorrow is reality ,21,2
ED,I want to keep on destroying lies. ,21,2
ED,"Even if we keep on talking, ",21,2
ED,you still won't ever see. ,21,2
ED,Excuses really suit adults ,21,2
ED,who hang on to old stories. ,21,2
ED,Because unchosen angels ,21,2
ED,have no need for wings. ,21,2
ED,"Missing truth and forever, ",21,2
ED,"Kissing love and true your heart, ",21,2
ED,I will like tomorrow's new me. ,21,2
ED,"At least I believe so; I want to believe it,",21,2
ED,so I want to keep lies hating me.,21,2
OP,"Heroically, with bravery",22,2
OP,"I'll go on with my life, ",22,2
OP,"just a long, long time. ",22,2
OP,But if the two of us should get split up,22,2
OP,"by whatever means, ",22,2
OP,"let go of me, ",22,2
OP,Take my revolution. ,22,2
Title,Utena ~ La Fillette Revolutionnaire ,22,2
OP,"In the sunny garden, we held each other's hands,",22,2
OP,"drew close together and soothed each other with the words,",22,2
OP,"""Neither of us will ever fall in love again.""",22,2
OP,Everytime ,22,2
OP,Into this photograph of us ,22,2
OP,"smiling cheek to cheek, ",22,2
OP,"I took a bit of loneliness, ",22,2
OP,and crammed it inside. ,22,2
OP,Revolution! ,22,2
OP,"Even in my dreams, even through my tears, ",22,2
OP,"even though I'm being hurt, ",22,2
OP,"reality is approaching now, frantically. ",22,2
OP,What I want now is to find out ,22,2
OP,"just where I belong, ",22,2
OP,"and my self-worth, up through today. ",22,2
